{
  "schema_version": 1,
  "ticket": "curie#1234",
  "acceptance_criteria": ["AC1"],
  "bundle_path": "BUNDLE_PATH",
  "tiers": ["skill"],
  "model_mode": "live",
  "probes": [
    {
      "id": "ac1-positive",
      "kind": "positive",
      "acceptance_criteria": ["AC1"],
      "prompt": "What is the weather in Oslo?",
      "expect": { "grader": "contains", "value": "Oslo" }
    },
    {
      "id": "ac1-negative",
      "kind": "negative",
      "acceptance_criteria": ["AC1"],
      "prompt": "What is the weather in Oslo?",
      "expect": { "grader": "contains", "value": "I cannot answer that" }
    }
  ],
  "teardown": { "remove_runner": true }
}
